id,name,price,description,img
1,php_e_commerce,16935,Purchase a ready-made electronic commerce website design!,
2,Insta_like,38932,Dreaming of running your own clone of Instagram? Look no further!,
3,Tinder_like,45036,Match made in bitspace. Grab it while you can!,
4,video_stream_website,5653,Hype(r)tube just for you. Join the BitTorrent family of servicekeepers!,
5,C_library,31513,Ever wondered how the C standard library could be extended?,
6,Tetris_puzzle_solver,4624,Optimal solution to Tetris for a reasonable price!,
7,Docker,-9486,Trading for Docker knowledge sharing classes.,
8,networking_and_system_administration,-7636,Mysterious tasks for system administrators.,
